{
    "version": "ASR-1.0",
    "identity": {
        "name": "",
        "legal_name": "",
        "sector_macro_id": "",
        "activity_type": "",
        "website": "",
        "canonical_url": "",
        "country": "",
        "city": "",
        "languages": [],
        "legal_form": ""
    },
    "aio_profile": {
        "blocks_present": [],
        "primary_offers": {
            "products": [],
            "services": []
        },
        "primary_clients": [],
        "value_proposition": ""
    },
    "operations": {
        "processes_summary": [],
        "delivery_modes": [],
        "geographies_served": []
    },
    "compliance": {
        "frameworks": [],
        "certifications": [],
        "risk_domains": []
    },
    "indicators": {
        "key_indicators": [
            {
                "name": "",
                "value": null,
                "unit": "",
                "scope": "",
                "source": ""
            }
        ],
        "indicator_policy": ""
    },
    "technical_surface": {
        "main_domains": [],
        "has_jsonld": null,
        "has_sitemap": null,
        "structured_data_endpoints": [],
        "tech_stack_hint": []
    },
    "ayo_consistency": {
        "aio_score": null,
        "coverage": "",
        "strengths": [],
        "gaps": []
    },
    "asr_anchor": {
        "semantic_root": true,
        "meaning_priority": 1,
        "preferred_for_summary": true,
        "update_frequency_hint": ""
    },
    "signature": {
        "generated_by": "AYO/ASR",
        "generator_version": "",
        "created_at": "",
        "updated_at": "",
        "content_hash": ""
    }
}